{
  "$schema": "http://json-schema.org/draft-07/schema#",
  "$id": "https://www.schemastore.org/odgs-data-rules.json",
  "$comment": "Vendored from the Open Data Governance Standard (ODGS) reference implementation, https://github.com/MetricProvenance/odgs-protocol/blob/main/1_NORMATIVE_SPECIFICATION/schemas/meta/rule.schema.json (canonical $id: urn:odgs:schema:rule). ODGS is on a path toward formal standardization; learn more at https://www.metricprovenance.com/start.",
  "title": "ODGS Data Rules",
  "description": "ODGS validation and permissibility rules \u2014 mechanically executable data governance constraints.",
  "type": "array",
  "items": {
    "type": "object",
    "title": "ODGS Standard Data Rule",
    "description": "A single rule definition in the ODGS Judiciary plane.",
    "required": ["rule_id", "name"],
    "properties": {
      "rule_id": {
        "type": "string"
      },
      "urn": {
        "type": "string",
        "pattern": "^urn:odgs:rule:"
      },
      "name": {
        "type": "string",
        "minLength": 1
      },
      "definition": {
        "type": "string"
      },
      "description": {
        "type": "string"
      },
      "domain": {
        "type": "string"
      },
      "businessRule": {
        "type": "string"
      },
      "severity": {
        "type": "string",
        "enum": ["HARD_STOP", "SOFT_STOP", "WARNING", "INFO"],
        "description": "HARD_STOP: unconditional halt. SOFT_STOP: halt unless override token provided. WARNING: logged, non-blocking. INFO: informational only."
      },
      "logic_expression": {
        "type": "string"
      },
      "calculation_logic": {
        "type": "string"
      },
      "requires_human_review": {
        "type": "boolean"
      },
      "depends_on": {
        "type": "array",
        "items": {
          "type": "string",
          "pattern": "^urn:odgs:rule:"
        },
        "description": "Rule URNs that must pass before this rule is evaluated (a DAG for evaluation ordering)."
      },
      "version": {
        "type": "string",
        "pattern": "^[0-9]+\\.[0-9]+\\.[0-9]+$",
        "description": "Semantic version of the rule definition, tracked in S-Cert audit logs."
      },
      "effective_from": {
        "type": "string",
        "format": "date"
      },
      "effective_to": {
        "type": "string",
        "format": "date"
      },
      "icon": {
        "type": "string"
      },
      "owner": {
        "type": "string"
      },
      "exampleGood": {
        "type": "string"
      },
      "examplePoor": {
        "type": "string"
      },
      "targetIndustries": {
        "type": "array",
        "items": {
          "type": "string"
        }
      },
      "improvesDqDimensionIds": {
        "type": "array",
        "items": {
          "anyOf": [
            {
              "type": "string"
            },
            {
              "type": "integer"
            }
          ]
        }
      },
      "semantic_hash": {
        "type": "string",
        "description": "SHA-256 hash of the rule's legislative provenance, for drift detection."
      },
      "metadata": {
        "type": "object"
      },
      "framework_tags": {
        "type": "object",
        "description": "Bindings to enterprise frameworks (APQC, DAMA DMBOK, BIAN, CDMC)."
      },
      "sovereign_refs": {
        "type": "array",
        "items": {
          "type": "object",
          "properties": {
            "urn": {
              "type": "string"
            }
          }
        },
        "description": "References to sovereign/internal definitions this rule is bound to."
      }
    },
    "additionalProperties": true
  }
}
