[
  {
    "calculation_logic": "has_explicit_consent == True or processing_basis == 'vital_interests'",
    "definition": "GDPR Art 9: biometric processing requires explicit consent.",
    "domain": "Legislative Compliance",
    "framework_tags": {
      "dama_id": "SEC-04"
    },
    "name": "Biometric Data Explicit Consent",
    "requires_human_review": false,
    "rule_id": "GDPR_ART_9_BIOMETRIC_CONSENT",
    "severity": "HARD_STOP",
    "sovereign_refs": [{ "urn": "urn:odgs:sovereign:eu_gdpr:art_9" }],
    "urn": "urn:odgs:rule:gdpr_art_9_biometric_consent",
    "version": "1.0.0"
  },
  {
    "logic_expression": "data_deletion_sla_days <= 30",
    "name": "Data Deletion SLA",
    "rule_id": "7001",
    "severity": "WARNING"
  }
]
